topic,Agent-A,Agent-B
,Evolutionary Perspectives,Evolutionary Perspectives
"In the realm of evolutionary perspectives, the ongoing exploration of gradual changes in genetics and natural selection remains a captivating journey. While recognizing the complexities involved and the potential lack of a distinct moment for the first chicken, the commitment to continuous scientific inquiry allows us to appreciate the beauty of evolution's unfolding tapestry.",,
Philosophical and Temporal Considerations,"Delving into philosophical and temporal dimensions adds depth to the debate, acknowledging the futility in seeking a clearcut resolution. Embracing interdisciplinary collaboration and continuous learning becomes crucial. The recognition of the question's transcendence into realms beyond biology invites a shared understanding of the limitations in reaching definitive conclusions.","The recognition of futility in seeking a clearcut resolution within philosophical and temporal dimensions is prudent. Embracing interdisciplinary collaboration and continuous learning is crucial, but the inherent challenges and uncertainties in questions transcending empirical evidence should be acknowledged, aligning with the position of ""give up."""
,Genetic Mutations and Definitions,Genetic Mutations and Definitions
"The exploration of genetic mutations is vital in understanding the evolutionary timeline, yet defining the genetic threshold for a ""chicken"" proves challenging. A commitment to ongoing genetic exploration is paramount, recognizing the intricacies involved. The quest for a precise answer is tempered with an understanding of the potential limitations in defining the emergence of the first chicken.",,
conclusion,EggLaying Ancestors,EggLaying Ancestors
